smartctl 7.4 2023-08-01 r5530 [x86_64-linux-6.13.7-1-default] (SUSE RPM)
Copyright (C) 2002-23, Bruce Allen, Christian Franke, www.smartmontools.org

=== START OF INFORMATION SECTION ===
Model Number:                       WD Blue SN580 1TB
Serial Number:                      24082D800908
Firmware Version:                   281010WD
PCI Vendor/Subsystem ID:            0x15b7
IEEE OUI Identifier:                0x001b44
Total NVM Capacity:                 1,000,204,886,016 [1.00 TB]
Unallocated NVM Capacity:           0
Controller ID:                      0
NVMe Version:                       1.4
Number of Namespaces:               1
Namespace 1 Size/Capacity:          1,000,204,886,016 [1.00 TB]
Namespace 1 Formatted LBA Size:     512
Namespace 1 IEEE EUI-64:            001b44 8b4750bda2
Local Time is:                      Fri Mar 28 10:30:01 2025 CDT
Firmware Updates (0x14):            2 Slots, no Reset required
Optional Admin Commands (0x0017):   Security Format Frmw_DL Self_Test
Optional NVM Commands (0x00df):     Comp Wr_Unc DS_Mngmt Wr_Zero Sav/Sel_Feat Timestmp Verify
Log Page Attributes (0x7e):         Cmd_Eff_Lg Ext_Get_Lg Telmtry_Lg Pers_Ev_Lg Log0_FISE_MI Telmtry_Ar_4
Maximum Data Transfer Size:         256 Pages
Warning  Comp. Temp. Threshold:     84 Celsius
Critical Comp. Temp. Threshold:     88 Celsius
Namespace 1 Features (0x02):        NA_Fields

Supported Power States
St Op     Max   Active     Idle   RL RT WL WT  Ent_Lat  Ex_Lat
 0 +     4.80W    4.80W       -    0  0  0  0        0       0
 1 +     3.30W    3.00W       -    0  0  0  0        0       0
 2 +     2.20W    2.00W       -    0  0  0  0        0       0
 3 -   0.0150W       -        -    3  3  3  3     1500    2500
 4 -   0.0050W       -        -    4  4  4  4    10000    6000
 5 -   0.0033W       -        -    5  5  5  5   176000   25000

Supported LBA Sizes (NSID 0x1)
Id Fmt  Data  Metadt  Rel_Perf
 0 +     512       0         2
 1 -    4096       0         1

=== START OF SMART DATA SECTION ===
SMART overall-health self-assessment test result: PASSED

SMART/Health Information (NVMe Log 0x02)
Critical Warning:                   0x00
Temperature:                        39 Celsius
Available Spare:                    100%
Available Spare Threshold:          10%
Percentage Used:                    0%
Data Units Read:                    23,560,433 [12.0 TB]
Data Units Written:                 28,532,425 [14.6 TB]
Host Read Commands:                 148,254,387
Host Write Commands:                472,534,092
Controller Busy Time:               455
Power Cycles:                       590
Power On Hours:                     3,866
Unsafe Shutdowns:                   13
Media and Data Integrity Errors:    0
Error Information Log Entries:      0
Warning  Comp. Temperature Time:    0
Critical Comp. Temperature Time:    0
Temperature Sensor 1:               59 Celsius
Temperature Sensor 2:               36 Celsius

Error Information (NVMe Log 0x01, 16 of 256 entries)
No Errors Logged

Self-test Log (NVMe Log 0x06)
Self-test status: No self-test in progress
No Self-tests Logged

smartctl 7.4 2023-08-01 r5530 [x86_64-linux-6.13.7-1-default] (SUSE RPM)
Copyright (C) 2002-23, Bruce Allen, Christian Franke, www.smartmontools.org

=== START OF INFORMATION SECTION ===
Model Family:     Western Digital Blue
Device Model:     WDC WD10EZEX-08M2NA0
Serial Number:    WD-WCC3F4881951
LU WWN Device Id: 5 0014ee 25f838418
Firmware Version: 01.01A01
User Capacity:    1,000,204,886,016 bytes [1.00 TB]
Sector Sizes:     512 bytes logical, 4096 bytes physical
Rotation Rate:    7200 rpm
Device is:        In smartctl database 7.3/5528
ATA Version is:   ACS-2, ACS-3 T13/2161-D revision 3b
SATA Version is:  SATA 3.1, 6.0 Gb/s (current: 6.0 Gb/s)
Local Time is:    Fri Mar 28 10:30:01 2025 CDT
SMART support is: Available - device has SMART capability.
SMART support is: Enabled

=== START OF READ SMART DATA SECTION ===
SMART overall-health self-assessment test result: PASSED

General SMART Values:
Offline data collection status:  (0x82) Offline data collection activity
                    was completed without error.
                    Auto Offline Data Collection: Enabled.
Self-test execution status:      (   0) The previous self-test routine completed
                    without error or no self-test has ever 
                    been run.
Total time to complete Offline 
data collection:        (11280) seconds.
Offline data collection
capabilities:            (0x7b) SMART execute Offline immediate.
                    Auto Offline data collection on/off support.
                    Suspend Offline collection upon new
                    command.
                    Offline surface scan supported.
                    Self-test supported.
                    Conveyance Self-test supported.
                    Selective Self-test supported.
SMART capabilities:            (0x0003) Saves SMART data before entering
                    power-saving mode.
                    Supports SMART auto save timer.
Error logging capability:        (0x01) Error logging supported.
                    General Purpose Logging supported.
Short self-test routine 
recommended polling time:    (   2) minutes.
Extended self-test routine
recommended polling time:    ( 117) minutes.
Conveyance self-test routine
recommended polling time:    (   5) minutes.
SCT capabilities:          (0x3035) SCT Status supported.
                    SCT Feature Control supported.
                    SCT Data Table supported.

SMART Attributes Data Structure revision number: 16
Vendor Specific SMART Attributes with Thresholds:
ID# ATTRIBUTE_NAME          FLAG     VALUE WORST THRESH TYPE      UPDATED  WHEN_FAILED RAW_VALUE
  1 Raw_Read_Error_Rate     0x002f   200   200   051    Pre-fail  Always       -       2
  3 Spin_Up_Time            0x0027   174   169   021    Pre-fail  Always       -       2275
  4 Start_Stop_Count        0x0032   086   086   000    Old_age   Always       -       14676
  5 Reallocated_Sector_Ct   0x0033   200   200   140    Pre-fail  Always       -       0
  7 Seek_Error_Rate         0x002e   200   200   000    Old_age   Always       -       0
  9 Power_On_Hours          0x0032   041   041   000    Old_age   Always       -       43291
 10 Spin_Retry_Count        0x0032   100   100   000    Old_age   Always       -       0
 11 Calibration_Retry_Count 0x0032   100   100   000    Old_age   Always       -       0
 12 Power_Cycle_Count       0x0032   095   095   000    Old_age   Always       -       5621
192 Power-Off_Retract_Count 0x0032   200   200   000    Old_age   Always       -       263
193 Load_Cycle_Count        0x0032   196   196   000    Old_age   Always       -       14538
194 Temperature_Celsius     0x0022   113   096   000    Old_age   Always       -       30
196 Reallocated_Event_Count 0x0032   200   200   000    Old_age   Always       -       0
197 Current_Pending_Sector  0x0032   200   200   000    Old_age   Always       -       0
198 Offline_Uncorrectable   0x0030   200   200   000    Old_age   Offline      -       0
199 UDMA_CRC_Error_Count    0x0032   200   200   000    Old_age   Always       -       0
200 Multi_Zone_Error_Rate   0x0008   200   200   000    Old_age   Offline      -       0

SMART Error Log Version: 1
No Errors Logged

SMART Self-test log structure revision number 1
Num  Test_Description    Status                  Remaining  LifeTime(hours)  LBA_of_first_error
# 1  Short offline       Completed without error       00%     43290         -
# 2  Short offline       Completed without error       00%     43274         -
# 3  Short offline       Completed without error       00%     43262         -
# 4  Short offline       Completed without error       00%     43248         -
# 5  Short offline       Completed without error       00%     43234         -
# 6  Short offline       Completed without error       00%     43219         -
# 7  Short offline       Completed without error       00%     43205         -
# 8  Short offline       Completed without error       00%     43189         -
# 9  Short offline       Completed without error       00%     43176         -
#10  Short offline       Completed without error       00%     43168         -
#11  Short offline       Completed without error       00%     43157         -
#12  Short offline       Completed without error       00%     43142         -
#13  Short offline       Completed without error       00%     43129         -
#14  Short offline       Completed without error       00%     43116         -
#15  Short offline       Completed without error       00%     43103         -
#16  Short offline       Completed without error       00%     43090         -
#17  Short offline       Completed without error       00%     43080         -
#18  Short offline       Completed without error       00%     43067         -
#19  Short offline       Completed without error       00%     43057         -
#20  Short offline       Completed without error       00%     43043         -
#21  Short offline       Completed without error       00%     43028         -

SMART Selective self-test log data structure revision number 1
 SPAN  MIN_LBA  MAX_LBA  CURRENT_TEST_STATUS
    1        0        0  Not_testing
    2        0        0  Not_testing
    3        0        0  Not_testing
    4        0        0  Not_testing
    5        0        0  Not_testing
Selective self-test flags (0x0):
  After scanning selected spans, do NOT read-scan remainder of disk.
If Selective self-test is pending on power-up, resume after 0 minute delay.

The above only provides legacy SMART information - try 'smartctl -x' for more

smartctl 7.4 2023-08-01 r5530 [x86_64-linux-6.13.7-1-default] (SUSE RPM)
Copyright (C) 2002-23, Bruce Allen, Christian Franke, www.smartmontools.org

=== START OF INFORMATION SECTION ===
Model Family:     Western Digital Blue
Device Model:     WDC WD10EZEX-08WN4A0
Serial Number:    WD-WCC6Y0AEJKH3
LU WWN Device Id: 5 0014ee 2bac0a925
Firmware Version: 02.01A02
User Capacity:    1,000,204,886,016 bytes [1.00 TB]
Sector Sizes:     512 bytes logical, 4096 bytes physical
Rotation Rate:    7200 rpm
Form Factor:      3.5 inches
Device is:        In smartctl database 7.3/5528
ATA Version is:   ACS-3 T13/2161-D revision 3b
SATA Version is:  SATA 3.1, 6.0 Gb/s (current: 6.0 Gb/s)
Local Time is:    Fri Mar 28 10:30:01 2025 CDT
SMART support is: Available - device has SMART capability.
SMART support is: Enabled

=== START OF READ SMART DATA SECTION ===
SMART overall-health self-assessment test result: PASSED

General SMART Values:
Offline data collection status:  (0x82) Offline data collection activity
                    was completed without error.
                    Auto Offline Data Collection: Enabled.
Self-test execution status:      (   0) The previous self-test routine completed
                    without error or no self-test has ever 
                    been run.
Total time to complete Offline 
data collection:        (10920) seconds.
Offline data collection
capabilities:            (0x7b) SMART execute Offline immediate.
                    Auto Offline data collection on/off support.
                    Suspend Offline collection upon new
                    command.
                    Offline surface scan supported.
                    Self-test supported.
                    Conveyance Self-test supported.
                    Selective Self-test supported.
SMART capabilities:            (0x0003) Saves SMART data before entering
                    power-saving mode.
                    Supports SMART auto save timer.
Error logging capability:        (0x01) Error logging supported.
                    General Purpose Logging supported.
Short self-test routine 
recommended polling time:    (   2) minutes.
Extended self-test routine
recommended polling time:    ( 114) minutes.
Conveyance self-test routine
recommended polling time:    (   5) minutes.
SCT capabilities:          (0x3035) SCT Status supported.
                    SCT Feature Control supported.
                    SCT Data Table supported.

SMART Attributes Data Structure revision number: 16
Vendor Specific SMART Attributes with Thresholds:
ID# ATTRIBUTE_NAME          FLAG     VALUE WORST THRESH TYPE      UPDATED  WHEN_FAILED RAW_VALUE
  1 Raw_Read_Error_Rate     0x002f   200   200   051    Pre-fail  Always       -       0
  3 Spin_Up_Time            0x0027   174   167   021    Pre-fail  Always       -       2300
  4 Start_Stop_Count        0x0032   087   087   000    Old_age   Always       -       13675
  5 Reallocated_Sector_Ct   0x0033   200   200   140    Pre-fail  Always       -       0
  7 Seek_Error_Rate         0x002e   200   200   000    Old_age   Always       -       0
  9 Power_On_Hours          0x0032   057   057   000    Old_age   Always       -       31569
 10 Spin_Retry_Count        0x0032   100   100   000    Old_age   Always       -       0
 11 Calibration_Retry_Count 0x0032   100   100   000    Old_age   Always       -       0
 12 Power_Cycle_Count       0x0032   097   097   000    Old_age   Always       -       3784
192 Power-Off_Retract_Count 0x0032   200   200   000    Old_age   Always       -       123
193 Load_Cycle_Count        0x0032   191   191   000    Old_age   Always       -       28716
194 Temperature_Celsius     0x0022   111   093   000    Old_age   Always       -       32
196 Reallocated_Event_Count 0x0032   200   200   000    Old_age   Always       -       0
197 Current_Pending_Sector  0x0032   200   200   000    Old_age   Always       -       0
198 Offline_Uncorrectable   0x0030   200   200   000    Old_age   Offline      -       0
199 UDMA_CRC_Error_Count    0x0032   200   200   000    Old_age   Always       -       0
200 Multi_Zone_Error_Rate   0x0008   200   200   000    Old_age   Offline      -       0

SMART Error Log Version: 1
No Errors Logged

SMART Self-test log structure revision number 1
Num  Test_Description    Status                  Remaining  LifeTime(hours)  LBA_of_first_error
# 1  Short offline       Completed without error       00%     31568         -
# 2  Short offline       Completed without error       00%     31552         -
# 3  Short offline       Completed without error       00%     31540         -
# 4  Short offline       Completed without error       00%     31526         -
# 5  Short offline       Completed without error       00%     31511         -
# 6  Short offline       Completed without error       00%     31497         -
# 7  Short offline       Completed without error       00%     31482         -
# 8  Short offline       Completed without error       00%     31467         -
# 9  Short offline       Completed without error       00%     31454         -
#10  Short offline       Completed without error       00%     31446         -
#11  Short offline       Completed without error       00%     31435         -
#12  Short offline       Completed without error       00%     31421         -
#13  Short offline       Completed without error       00%     31407         -
#14  Short offline       Completed without error       00%     31394         -
#15  Short offline       Completed without error       00%     31384         -
#16  Short offline       Completed without error       00%     31371         -
#17  Short offline       Completed without error       00%     31361         -
#18  Short offline       Completed without error       00%     31347         -
#19  Short offline       Completed without error       00%     31338         -
#20  Short offline       Completed without error       00%     31324         -
#21  Short offline       Completed without error       00%     31309         -

SMART Selective self-test log data structure revision number 1
 SPAN  MIN_LBA  MAX_LBA  CURRENT_TEST_STATUS
    1        0        0  Not_testing
    2        0        0  Not_testing
    3        0        0  Not_testing
    4        0        0  Not_testing
    5        0        0  Not_testing
Selective self-test flags (0x0):
  After scanning selected spans, do NOT read-scan remainder of disk.
If Selective self-test is pending on power-up, resume after 0 minute delay.

The above only provides legacy SMART information - try 'smartctl -x' for more

